#;;id;submitdate;lastpage;startlanguage;token;A;B1;B2;B3;B4;B5;C1;C2;C3;C4;C5;D1;D2;D3;D4;E1;E2;F;G1;G2;G3;G4;H1;H2;H3;H4;I1;I2;I3;I4;J1.1;J1.2;J2.1;J2.2;J3.1;J3.2;J4.1;J4.2;J5.1;J5.2;J6.1;J6.2;J7.1;J7.2;J8.1;J8.2;J9.1;J9.2;J10.1;J10.2;K1;K2;L;M1;M2;M3;M4;M5;N1;N2;O;P1;P2;Q;R1;R2;R3;R4;R5;RA;T1;T2;T3;T4;T5;TA;U1;U2;V1.1;V1.6;V1.5;V1.4;V1.3;V2.1;V2.6;V2.5;V2.4;V2.3;V3.1;V3.6;V3.5;V3.4;V3.3;V4.1;V4.6;V4.5;V4.4;V4.3;V5.1;V5.6;V5.5;V5.4;V5.3;V8.1;V8.6;V8.5;V8.4;V8.3;V7.1;V7.6;V7.5;V7.4;V7.3;V6.1;V6.6;V6.5;V6.4;V6.3;W1;W2;X;Y1;Y2;Y3;Y4;Y5;YA1;YA2;YA3;YA4;YA5;Z1;Z2;Z3;Z4;Z5;Z6;ZZ;AA1;AA2;AA3;AA4;AA5;AAA;BB1;BB2;BB3;BB4;BB5;BB6;BB7;BBB;CC1;CC2;CC3;CC4;CC5;CC6;CCC;DD;EE1;EE2;FF1;FF2;FF3;FF4;FF5;FFF;GG1;GG2;HH1;HH2;HH3;HH4;HH5;HH6;HH7;HH8;II1;II2;JJ1;JJ2;JJ3;JJ4;JJ5;JJ6;JJ7;JJJ;KK;LL
1;;9;1980-01-01 00:00:00;3;es;E5Oy9K0zNejhciE;Álvaro Aguilar Rivera;;;Y;;;;;;Y;;;;;Y;Y;;En los diversos cursos que se llevan, ya que la ética es vital en la formación como futuros Contadores y Auditores, en la aplicación de las mejores prácticas profesionales, así que diría que en los cursos de Contabilidad y Auditoría principalmente.;;;Y;;;;Y;;;Y;;;;No;;No;;No;;No;;No;;No;Sí (Cursos de contabilidad que relaciones los valores éticos con la futura profesión que vamos a ejercer, la profesora Nadia Ugalde Binda y otros plantean mucho este tema y realizan trabajos sobre esto);;Sí (Cursos de Contabilidad, los impartidos por Nadia Ugalde Binda tratan muchísimo estos temas);;;No;;No;Y;;Por que la futura profesión que vamos a ejercer involucra el manejo de recursos e información muy valiosos, y una mala práctica que atente a los principios éticos puede llevar a las organizaciones al cierre de sus operaciones y a uno como profesional a perder la licencia e incluso hasta ir a la cárcel.;Honestidad;Responsabilidad;Ser Transparentes;Solidaridad;Sinceridad;Y;;Por ejemplo manejo de conflictos entre grupos de trabajo, en ocasiones existen proyectos que se prestan mucho para el plagio, por ejemplo investigaciones o tareas, y cualquier estudiantes que no maneje este principio puede caer en esas situaciones.;;Y;;;;;;;;;;;;;;;Y;;;;;;;;;;;;;;;;;;;;;;;;;;;;;;;;;;;;;;;;;Y;;Por que es un tema demasiado útil en nuestra profesión, la toma de decisiones en muchas ocasiones puede atentar contra este principio, y el recibir un taller relacionado a esto, le puede servir a uno como futuro profesional a saber como actuar ante diferentes situaciones de riesgo.;;;Y;;;Y;;Y;;;;;;Y;Y;;;;;Y;;;;A3;A1;A4;;;;;;A2;A5;A1;;;;;Fomentar proyectos prácticos y de investigación en relación a este tema, por ejemplo seminarios, talleres y demás que permitan enseñar a los estudiantes a como enfrentarse ante diferentes situaciones que atenten contra las buenas prácticas profesionales.;;Y;;;;;;;;Y;;;;;;;;;;Y;;;;;;;;;Fomentar talleres, prácticas, trabajos de investigación, que puedan poner a los estudiantes a prueba para ver la reacción que tienen ante estas situaciones;
2;;12;1980-01-01 00:00:00;3;es;KbaT3sh23SC2JVC;Marco Tulio Segura Monge;Y;Y;;;Y;;;;Y;Y;;;Y;;Y;;En realidad es una gran cantidad de cursos en la que algún profesor dice algo suelto, pero nunca nada concreto.;;Y;;;;Y;;;Y;;;;;No;;no;;no;;no;;no;;no;;no;;no;;no;Decisiones de inversión en vez de dar clases sobre lo correspondiente se dedico a hablar de etica. No concidero tampoco que haya sido algo muy adecativo, pero es el curso que mas ha tocado el tema.;;Y;;Me parece que es una de las grandes carencias de la carrera. Muchas veces la mayor diferencia entre tomar una decisión x o y es la formación etica del administrador. Debería haber un curso de ética al inicio de la carrera.;Valoración de consecuancias no directas por la decisión tomada por el adminstrador.;Tener conocimiento que al otro lado de las decisión tomada hay un ser humano.;Rendición de cuentas a la junta directiva ;Importancia de la ética en las empresas privadas desde la perspectiva del gobierno.;Importancia de no ser complice por callar o permiter.;;Y;;;Y;;;;;;;;;;;;;;;Y;;;;;;;;;;;;;;;;;;;;;;;;;;;;;;;;;;;;;;;;;Y;;Como ya dije, la etica me parece la base del accionar de un administrador. Las decisiones que toma no solo lo afectan a él, pueden incluso afectar personas a las que ni conoce de manera insospechadas.;Y;;Y;;;;;Y;Y;;;Y;Y;;Y;;;;;Y;Y;;;A1;A7;A6;A4;A5;A3;A2;Al tener un ética fuerte en todas las personas de una administración, junto con una clara declaración de los valores y la misión estratégica de la empresa, se facilita la toma de decisiones por parte de los administradores.;A6;;;;;;Según entendí la pregunta, respondo otro porque no creo que la escuela de administración de negocios de la UCR cumpla ninguno de esos papeles, y no tengo comparación de otras escuelas para respoder.;"Al menos un curso orientado a la ética en primer año.
charlas constantes, algunos de caracter obligatorio, otros no, pero funcionales (no como la mayoría de charlas de la carrera).
No intentar meter la ética en alguna clases o como tema específico de un curso, ya que los profesores lo ven como una perdida de tiempo y los alumnos concideran que esa es una clase a la que se puede faltar. 
Traer conferensistas que puedan generar interes real de parte de los estudiantes, ideal sería si pudieran contar experiencias propias en el tema.";Y;;;;;;Y;La carta al estudiante de la mayoría de cursos trae esos valores (no se si todas);;Y;;;;;;;;;;Y;;;;;;;;;No conozco esos valores, no sabría que recomendar.;Excelente iniciativa.
3;;15;1980-01-01 00:00:00;3;es;taYw630e0~cN7Zt;Carolina Garro;;Y;;;;;;;;Y;;;;Y;Y;;En varios cursos, principalmente los relacionados con Gerencia  se menciona el tema, si talvez no como parte del plan, si como parte de otros temas relacionados.;;;Y;;;;Y;;;Y;;;;No;;No;;No;;No;;No;;No;Sí, Seminario Integrado de Alta Gerencia;;;No;Si;;;;Y;;Porque es un tema muy actual y los valores están en decadencia, porque es parte de la formación integral de cualquier profesional, principalmente de alguno que puede llegar a dirigir empresas.;Responsabilidad;Honestidad;Justicia;Humildad;Tolerancia;;Y;;;Y;;;;;;;;;;;;;;;Y;;;;;;;;;;;;;;;;;;;;;;;;;;;;;;;;;;;;;;;;;Y;;Por que siempre es bueno actualizarse y aprender sobre temas de competencias blandas.;;Y;;Y;;Y;;;Y;;;;Y;Y;Y;;;;;Y;;;;A1;A3;A2;A4;A6;A5;;;A3;A1;A2;;;;;;;Y;;;;;;;;Y;;;;;;;;;;Y;;;;;;;;;Debe ser una parte integral de los temas que se tratan en los cursos;
4;;17;1980-01-01 00:00:00;3;es;xHi2l5ITg7GPZTB;CESAR GERARDO MATA ALPIZAR;;;;Y;;;;;;Y;;;;Y;Y;;AUDITORIA GUBERNAMENTAL;;;Y;;;;Y;;;Y;;;Seminario de la Realidad Nacional;;Seminario de la Realidad Nacional;;SISTEMAS DE COSTEO GERENCIAL, NORMAS DE AUDITORIA, INFORMATICA II;;Seminario de la Realidad Nacional;;;NO;TRABAJO COMUNAL;;;NO;;NO;AUDITORIA GUBERNAMENTAL;;;NO;Y;;ES UNA CARRERA DE GRAN RESPONSABILIDAD ANTE LA SOCIEDAD Y POR SU NATURALEZA DE ESTUDIO Y TRABAJO SE REQUIERE DE PROFESIONALES FORMADOS CON UNA BUENA ETICA;HONESTIDAD;RESPONSABILIDAD;TRANSPARENCIA;BIEN COMUN;SOIIDARIDAD;Y;;NO RECUERDO UNO EN ESPECIFICO;;Y;;;;;;;;;;;;;;;Y;;;;;;;;;;;;;;;;;;;;;;;;;;;;;;;;;;;;;;;;;Y;;PARA FORMARME INTEGRALMENTE COMO PROFESIONAL EN CONTADURÍA PUBLICA;;;Y;;;;;;Y;;Y;Y;;;Y;;;Y;Y;;;;;A1;A4;A3;A5;A2;A6;;;A1;A2;A5;A3;A4;;;;;Y;;;;;;;;Y;;;;;;;;;;Y;;;;;;;;;MAYOR DIVULGACIÓN Y ENSEÑANZA DE LA ÉTICA PROFESIONAL EN LOS CURSOS;NO
5;;20;1980-01-01 00:00:00;3;es;YNM6xmOBE5uL4kI;Gloriana Zuñiga Meneses;Y;;;;;;;;Y;;;;;Y;Y;;Practica integrativa;;;Y;;;;Y;;;;Y;;Si;;Si;;;No ;Si;;;No;;No;;No;;No;Si;;;;Y;;Forma parte del ser profesional que se está formando, muestra la calidad de administrador que será, su ética y moral profesional, responsabilidad social que pueda llegar a sentir y aplicar en un negocio.;Lealtad;Honestidad;Responsabilidad;Respeto;Trabajó en equipo;;Y;;;Y;;;;;;;;;;;;;;;Y;;;;;;;;;;;;;;;;;;;;;;;;;;;;;;;;;;;;;;;;;Y;;Porque mejoraría mi formación personal y profesional;;Y;Y;Y;;Y;;Y;;;Y;Y;;Y;;;;;;Y;;;;A1;A2;A3;A4;A6;A5;;;A3;A5;A2;A1;A4;;;Todo debe empezar por los profesores, que sean los principales promotores de ética profesional y a partir de ahí realizar otra actividades para fomentarla en la escuela;;Y;;;;;;;;Y;;;;;;;;;;Y;;;;;;;;;Hacerlo público de mejor manera, de tal forma que es estudiantado esté enterado;
6;;23;1980-01-01 00:00:00;3;es;hon__poWs2mkpus;Shirley María Montealegre Carvajal;Y;;;;;;;;Y;;;;;Y;Y;;Seminario de Alta Gerencia ;;;Y;;;Y;;;;;Y;;;NO;;NO;;NO;;NO;;NO;;NO; SEMINARIO DE ALTA GERENCIA;; SEMINARIO DE ALTA GERENCIA;;;NO;;NO;Y;;Tomando en cuenta la situación actual del país e inclusive la situación mundial, existe una brecha entre lo profesional y lo ético. Muchos problemas de fraude, corrupción, mala administración y demás se deben a esa falta de ética profesional y el perder la conciencia de que es lo correcto y que no. ;HONESTIDAD;RESPETO;EMPATÍA;CARIDAD;SOLIDARIDAD;Y;;"Diariamente como estudiantes nos vemos en controversia entre ser persona éticas y no, si no hago una tarea y miento, o soy honesta y responsable por no hacerla. Son situaciones ""insignificantes"" pero en pequeñas decisiones demostramos que persona somos.";;Y;;;;;;;;;;;;;;;Y;;;;;;;;;;;;;;;;;;;;;;;;;;;;;;;;;;;;;;;;;Y;;Es escenial en nuestra formación como futuros empresarios. ;;;Y;;;;;Y;;;Y;;Y;;Y;;;;;Y;;;;A6;A3;A2;A1;A4;A5;;;A3;A5;A1;A4;A2;;;La práctica de proyectos relacionados con la ética dentro de las comunidades me parece que es una idea en la que podemos, como estudiantes, aplicar la teoría y generar beneficios a los demás. ;;Y;;;;;;;;Y;;;;;;;;;;Y;;;;;;;;;;
7;;25;1980-01-01 00:00:00;3;es;npUhMa~1YOtCeET;Gloriana Chaves Barquero;Y;;;;;;;Y;;;;;;Y;Y;;No hay un curso que pueda decir puntualmente pero a lo largo de la carrera se han dado temas en diferentes cursos y charlas que de una u otra forma el tema de la ética sale a flote y se nos menciona lo importante de hacer las cosas bien.;;;Y;;;;Y;;;Y;;;;No;;No;;No;Si;;;No;;No;;No;;No;;No;;;Y;;porque en lo personal el ser profesional es más que tener un papel bajo nuestro brazo, sino es ser una persona con valores, educación y moral al desempeñar la carrera en la que se ha especializado;Honestidad;Responsabilidad;Respeto;Tolerancia;Lealtad;;Y;;;Y;;;;;;;;;;;;;;;Y;;;;;;;;;;;;;;;;;;;;;;;;;;;;;;;;;;;;;;;;;Y;;Porque una persona ética tiene mayores méritos.;;;;Y;;Y;;;;;Y;Y;;Y;;;;;;Y;;;;A1;A2;A4;A3;A5;A6;;;A4;A3;A1;A5;A2;;;Casos Inspiradores, de personas reconocidas por su ética y buen labor en su ámbito laboral y profesional.;;Y;;;;;;;;Y;;;;;;;;;;Y;;;;;;;;;En cada curso siempre dar espacio para hablar de la ética y enfocar cada actividad en este tema;
8;;28;1980-01-01 00:00:00;3;es;Jj7ylmzX285sqvs;Angie Palma Salazar;Y;;;;;;;;Y;;;;;Y;Y;;"- Mercadeo
- RRHH
- Liderazgo
- Práctica Integrativa";;;Y;;;;Y;;Y;;;;;no;;no;;no;;no;;no;;no;Sí, práctica integrativa;;;no;;no;;no;Y;;Trae beneficios en la vida profesional y personal como por ejemplo la confianza y la reputación;integridad;responsabilidad;prudencia;empatía;fortaleza;;Y;;;Y;;;;;;;;;;;;;;;Y;;;;;;;;;;;;;;;;;;;;;;;;;;;;;;;;;;;;;;;;;;Y;;;;;;;;;;;;;;;;;;;;;;Y;;;A1;A4;A2;A3;A5;A6;;;A3;A1;A2;A5;A4;;;Incluirlo dentro de las clases y los cursos que ya se imparten;;Y;;;;;;;;Y;;;;;;;;;;Y;;;;;;;;;Hacerle más publicidad;
9;;30;1980-01-01 00:00:00;3;es;p7E1CafnBIWW~kA;Xiany Marín León;;Y;;;;;;;;Y;;;;Y;;Y;;;Y;;;;Y;;;Y;;;;;No;;No;;No;;No;;No;;No;;No;;No;;No;;;Y;;Porque la ética en los negocios y en la vida es muy importante, llega a identificarnos como persona o como organización y si no se tienen estas buenas prácticas no se colabora con el binestar de los que están a nuestro alrededor.;Honestidad;Responsabilidad;Puntualidad;Sinceridad;Compañerismo;Y;;Como estudiante principalmente a la hora de hacer los trabajos;;Y;;;;;;;;;;;;;;;Y;;;;;;;;;;;;;;;;;;;;;;;;;;;;;;;;;;;;;;;;;Y;;Porque en los negocios es un tema importante que se debe de manejar;Y;;Y;;;;Y;Y;;;Y;Y;Y;;;;;;;Y;;;;A4;A5;A2;A6;A3;A1;;;A3;A1;A4;A5;A2;;;Dar un curso donde el tema central sea la ética en los negocios;;Y;;;;;;;;Y;;;;;;;;;;Y;;;;;;;;;Que los comuniquen;
10;;32;1980-01-01 00:00:00;3;es;yOjJz3zPMMe12KA;Edgar Granados Peraza;Y;;;;;;;Y;;;;;Y;;Y;;"Principios de gerencia
Economía Internacional I
Introducción a la administración
Entorno legal";;Y;;;;;Y;;;Y;;;Seminario de Realidad Nacional;;Seminario de Realidad Nacional;;;No;Seminario de Realidad Nacional;;;No;Seminario de Realidad Nacional;;;No;;No;Entorno Legal;;;No;Y;;Porque en la mayoría de los trabajos proyectados para las careras de la escuela es vital conocer de ética laboral principalmente.;Integridad;Disciplina;Compromiso;Responsabilidad;Respeto;;Y;;;Y;;;;;;;;;;;;;;;Y;;;;;;;;;;;;;;;;;;;;;;;;;;;;;;;;;;;;;;;;;Y;;Porque es un tema interesante;;;Y;;;Y;;Y;;;;Y;;Y;Y;;;;;Y;;;;A3;A5;A4;A1;A2;A6;;;A5;A2;A4;A1;A3;;;Implementar un taller donde se impartan tema referentes por profesionales en la materia. Además de que el taller sea reconocido para poder agregarlo al currículum;;Y;;;;;;;;Y;;;;;;;;;;Y;;;;;;;;;;
11;;33;1980-01-01 00:00:00;3;es;XsIKxGq2yi~qNcN;IVAN MAURICIO ARAGON ALVAREZ;Y;Y;;;;;;;;Y;;;;Y;Y;;INTRODUCCION A LA ADMINISTRACION. RELACIONES HUMANAS EN CONTEXTO EMPRESARIAL. PRACTICA INTEGRATIVA PARA TOMA DE DECISIONES. ESTRUCTURA DE LA CONTABILIDAD. MERCADEO GERENCIAL. GERENCIA DE INVESTIGACION DE MERCADOS. MERCADEO DE SERVICIOS. MERCADEO INTERNACIONAL. SEMINARIO DE ALTA GERENCIA. SON LOS QUE RECUERDO.;;;Y;;;;Y;;;;;Y;MERCADEO INTERNACIONAL;ENTORNO LEGAL DE LAS EMPRESAS II;EMPRESARIEDAD E INNOVACION;INTRODUCCION A LAS TECNLOGIAS DE INFORMACION;GERENCIA DE BASES DE DATOS;SOCIOLOGIA BASICA;MERCADEO INTERNACIONAL;SISTEMAS DE INFORMACION GERENCIAL;NS/NR;NS/NR;EMPRESARIEDAD E INNOVACION;NS/NR;INTROD. A LA ADM. Y MERCADEO INTER.;NS/NR.;MERCADEO INTERNACIONAL;GERENCIA DE VENTAS Y DISTRIBUCION;ESTRATEGIAS INTEGRADAS DE MERCADEO;ESTRATEGIAS Y TACTICAS DE NEGOCIACION;;;Y;;PORQUE ES PARTE DEL SER HUMANO. SI SE QUIERE SER INTEGRAL SE DEBE ENSEÑAR A SERLO.;INTEGRIDAD;RESPETO/TOLERANCIA;MUTUALIDAD;HONRADEZ;SOLIDARIDAD;Y;;A LA HORA DE ELABORAR TRABAJOS FINALES SIN PLAJIAR. NO COPIANDO EN EVALUACIONES. OBTENER BUEN RENDIMIENTO O RESULTADOS SIN CERRUCHAR PISOS. EN LA PRUDENCIA DE SABER CUÁNDO CALLAR A PESAR DE CONOCER INFORMACIÓN SOBRE PROFESORES Y ESTUDIANTES QUE PODRÍAN DAÑAR ALGO O A ALGUIEN. USO RACIONAL DE LOS RECURSOS DE LA UNIVERSIDAD. EN FIN EN MI COMPORTAMIENTO COMO ESTUDIANTE Y FUTURO PROFESINAL MIENTRAS ASISTO A LA UNIVERSIDAD.;Y;;VOLUNTARIADO UCR. VOLUNTARIADO INDEPENDIENTE A TRAVÉS DEL CLUB DE GUÍAS MAYORES DE LA IGLESIA ADVENTISTA.PRÁCTICAS DE RECICLAJE DESDE EL HOGAR. FUI GANADOR DEL PRIMER CONCURSO DE INICIATIVAS ESTUDIANTILES DE LA VAS EN TEMA DE AMBIENTE. ;A1;A2;A3;A4;A5;INTEGRIDAD A LA HORA DE DESARROLLARSE COMO INDIVIDUO SEA CUAL SEA EL CAMPO EN EL QUE SE ENCUENTRE.;A3;A4;A2;A1;A5;BUROCRESIA EN LA TRAMITOLOGIA. FALTA DE SEGUIMIENTO. FALTA DE VISIÓN. ESCASO PRESUPUESTO.;Y;;CONFERENCIA;LA ÉTICA EN LOS NEGOCIOS;UCR, EAN;AUDITORIO DE DERECHO;2004;SEMINARIO;LIDERAZGO;IGLESIA ADVENTISTA;CENTRO EDUCATIVO ADVENTISTA DE HATILLO;2008;SEMINARIO-TALLER;METODOLOGIAS DE INVESTIGACION;UCR-EAN;AUDITORIO DE CIENCIAS ECONOMICAS;2013;CAPACITACION;JURAMENTACION PARA ELECCIONES PRESIDENCIALES 2014;TSE;ESCUELA CARLOS SANABRIA MORA;2014;CURSO;ÉTICA VS MORAL;UCR, EAN, MERCADEO INTERNACIONAL;AULA 142 CE;2015;;;;;;;;;;;;;;;;Y;Y;PORQUE SIEMPRE ME HE PREOCUPADO POR SER MEJOR Y SUPERARME EN TEMAS SENSIBLES. ADEMAS ES UNA OPORTUNIDAD PARA FORTALECER MIS HABILIDADES BLANDAS.;;Y;Y;;;;;Y;Y;;;Y;Y;Y;;;;;;Y;;;;A1;A3;A5;A6;A4;A2;;;A1;A2;A4;A5;A3;;;DEJAR DE USAR LOS RECURSOS EMPRESARIALES O DEL GOBIERNO PARA USO PERSONAL. INCLUIR EL TEMA EN CONFERENCIAS PERIODICAS PARA TENERLO PRESENTE. ;Y;;;Y;;;;;Y;;ETICA;TOLERANCIA;SOLIDARIDAD;PERSEVERANCIA;ALEGRIA;EMPRENDEDURISMO;NS/NR;NS/NR;;Y;;;;;;;;;QUE SE REALICEN GIRAS A GRUPOS SENSIBLES O VULNERABLES DE LAS COMUNIDADES. ;LES FELICITO POR LA INICITAIVA TOMADA.
12;;39;1980-01-01 00:00:00;3;es;hGAq07EQDyvnyBp;Alexander Acuña Gonzalez;;Y;;;;;;;;Y;;;;Y;Y;;En ciertos cursos de liderazgo, se ha visto el tema de la etica pero no con mucha seriedad.;;Y;;;;;Y;;;;Y;;;no;;no;;no;;no;;no;;no;si, liderazgo y practica integrativa;;;no;si liderazgo y practica integrativa;;;;Y;;Por que como futuros responsables de grandes empresas, tenemos mucha responsabilidad de lo que pueda suceder en el pais.;Responsabilidad Social;Equidad;Compromiso;Humildad;;Y;;Copiar en examenes, pasarse tareas, cosas que a veces minimizamos por siguen siendo falta de etica;;Y;;;;;;;;;;;;;;;Y;;;;;;;;;;;;;;;;;;;;;;;;;;;;;;;;;;;;;;;;;Y;;Es un tema que lo desarrolla a uno mas allá de un simple profesional sino tambien como persona;;;Y;;;;;;;Y;;Y;Y;Y;;;;;;Y;;;;A6;A1;A4;A5;A3;A2;;;A2;A5;A1;A3;;;;Que no sea un tema de ver en una presentacion de power point discutirlo y ya.;;Y;;;;;;;;Y;;;;;;;;;;Y;;;;;;;;;Se pueden desarrollar retiros o campamentos entre los estudiantes.;
13;;40;1980-01-01 00:00:00;3;es;5s7RcwkrTY2ljxC;Gloriana Aguilar Leitón;Y;Y;;;;;;;;Y;;;Y;Y;Y;;"Recuerdo que donde más se menciona fue en Entorno legal I Y II 
Sin embargo muchos cursos tienen un tema relacionado con esto. Excepto los de finanzas";;;Y;;;;;;;Y;;;;no;;no;;no;;no;;no;;no;;no;;no;si, Gerencia de Mercadeo IV año;;;;Y;;Porque algunas veces se menciona pero muy por encima, y no se explora con profundidad porque es realmente necesario ser ético, por el bienestar de la sociedad a LP.;Responsabilidad;Respeto;Solidaridad;Libertad ;Cooperación;Y;;En toda la carrera, en desarrollo de proyectos de investigación;;Y;;;;;;;;;;;;;;;Y;;;;;;;;;;;;;;;;;;;;;;;;;;;;;;;;;;;;;;;;;Y;;Porque es necesario;;Y;;;;Y;;;;;;Y;Y;;Y;;;;;Y;;;;A4;A1;A3;A2;A6;A5;;;A5;A1;A3;A4;A2;;;Dar un curso de ética o un seminario optativo ;;Y;;;;;;;;Y;;;;;;;;;;Y;;;;;;;;;Darlos a conocer más, por medio de afiches un boletin o actividades en la escuela;
14;;44;1980-01-01 00:00:00;3;es;OVTN6Og5vEeSi3q;Mariel Villalobos Díaz;;Y;;;;;;;;Y;;;;Y;Y;;Relaciones humanas, mercadeo internacional, estrategias integradas de mercadeo;;;Y;;;;;Y;;Y;;;no;no;no;no;no;no;no;no;no;no;no;no;no;no;no;no;estrategias integradas de mercadeo;;no;no;Y;;se debería a aprender a como llevar los problemas éticos dentro de una empresa;liderazgo;honestidad;responsabilidad;solidaridad;respeto;Y;;"profesores ""mirones"", preferencia por estudiantes hasta el punto de regalarles el curso";;Y;;;;;;;;;;;;;;;Y;;;;;;;;;;;;;;;;;;;;;;;;;;;;;;;;;;;;;;;;;Y;;es importante para mi futura profesión;;;;Y;;Y;Y;;;;;;Y;;Y;;;;;Y;;;;A1;A6;A4;A3;A2;A5;;;A2;A3;A1;A5;A4;;;que los profesores estén bajo vigilancia, ;;Y;;;;;;;Y;;Etica;Tolerancia;Solidaridad;Perseverancia ;Alegria;;;;;Y;;;;;;;;;que se apliquen realmente;
15;;46;1980-01-01 00:00:00;3;es;v53MrstnC_Bj8NS;Felipe Bonilla Agüero;;;Y;Y;;;;;Y;Y;;;;Y;;Y;;;;Y;;;Y;;;Y;;;;;No.;;No.;;No.;;No.;;No.;;No.;;No.;;No.;;No.;;No.;Y;;"Actualmente hay mucha corrupción, a nivel político y empresarial. 
Se debe velar por la formación de profesionales que posean bases sólidas a nivel ético, que no se preocupen únicamente por obtener dinero, sino, hacerlo de una forma honesta y en la medida de lo posible ayudando a la comunidad o al país en general.";Justicia;Responsabilidad;Honestidad;Respeto;Solidaridad;Y;;"Muchos de mis compañeros me han incitado a realizar trampa en las evaluaciones, copiando o utilizando ""forros"".";;Y;;;;;;;;;;;;;;;Y;;;;;;;;;;;;;;;;;;;;;;;;;;;;;;;;;;;;;;;;;Y;;Como mencioné anteriormente, es un tema que considero de gran relevancia.;;;Y;;Y;;Y;;Y;;;;;Y;Y;;;;;;Y;;;A1;A4;A3;A2;A6;A5;;;A1;A2;A5;A3;A4;;;Participación en la discusión y resolución de problemas actuales referentes a la ética.;;Y;;;;;;;;Y;;;;;;;;;;Y;;;;;;;;;Realización de Talleres.;Los felicito por la iniciativa, me parece de gran importancia este tema y creo que se están esforzando por mejorar.
16;;51;1980-01-01 00:00:00;3;es;plHgHGZrq3mRxze;johanna quesada campos;Y;;;;;;;;Y;;;;;Y;Y;;gerencia de rh, principios de gerencia;;Y;;;Y;;;;;Y;;;;no;;no;;no;;no;;no;;no;;no;;no;gerencia rh;;;;Y;;para desempeñarnos como profesionales transparentes con buenos principios y buscando el común, o al menos sin dañar nuestro entorno;honestidad;asertividad;empatía;solidaridad;perseverancia;;Y;;;Y;;;;;;;;;;;;;;;Y;;;;;;;;;;;;;;;;;;;;;;;;;;;;;;;;;;;;;;;;;Y;;para poder responder mejor a una situación de esas, tomar mejores decisiones.. hay profesores que asumen que uno ya conoce el tema o es algo poco importante y aunq esté dentro de los temas lo saltan;;;;Y;;;;;Y;;;Y;;Y;Y;;;;Y;;;;;A4;A6;A2;A1;A3;A5;;;A5;A2;A3;A1;A4;;;primero que capaciten a los profesores para que ellos le den valor al tema y así poder transmitirlo a los estudiantes;;Y;;;;;;;;Y;;;;;;;;;;Y;;;;;;;;;colocar murales sobre el tema, organizar actividades como talleres;
17;;53;1980-01-01 00:00:00;3;es;HS_efG7F0E_Ko_b;;Y;;;;;;;;Y;;;;;Y;Y;;Algunos de finanzas, pero no en el ambito nacional;Y;Y;;;Y;;;;Y;;;;;No;;No;;No;;No;;No;;No;;No;;No;;No;;No;Y;;Porque los futuros profesionales y futuras generaciones deben tener la herramientas para hacer de este pais uno mejor, ya vemos dia a dia el nivel de corrupcion en el pais y la universidad tiene la oportunidad de hacer algo al respecto empezando con la formacion de los alumnos;Lealtad;Humildad;Confianza;Compañerismo;Solidaridad;Y;;Todos los trabajos de incestigacion, asegurarse que no sean copias cuando son trabajos en grupo porque muchas veces a la gente no le importa y lo perjudican a uno;;Y;;;;;;;;;;;;;;;Y;;;;;;;;;;;;;;;;;;;;;;;;;;;;;;;;;;;;;;;;;Y;;Porque es fundamental para el futuro;Y;Y;;Y;;Y;;;;;Y;Y;;;Y;;;;;Y;Y;;;A1;A6;A4;A2;A5;A3;;;A3;A5;A1;A2;A4;;;Cursos y casos;Y;;;;Y;;;;;Y;;;;;;;;;;Y;;;;;;;;;Talleres;
18;;54;1980-01-01 00:00:00;3;es;6hKZPzBqGRuE9Hp;Silvia Priscilla Leon Serrano;Y;;;;;;;;Y;;;;Y;;Y;;Todos ;;;Y;;;Y;Y;;;Y;;;Empresariedad e Innovación ;;Empresariedad e Innovación;;;No;;no;;no;;no;;no;si;;si;;;;Y;;Porque forma personas lideres que buscan una solución optima en lugar de buscar el beneficio propio ;Innovacion;Responsabilidad;Etica;Liderazgo;Sinceridad ;Y;Y;Una vez un profesor me envió el examen por error  ;Y;;Voluntariado ;A4;A2;A3;A1;;;A4;A3;A1;A2;;;Y;;;;;;;;;;;;;;;;;;;;;;;;;;;;;;;;;;;;;;;;;;Y;;Es importante ;;;Y;;;Y;;;Y;;;Y;;Y;;;;;Y;;;;;A3;A4;A6;A1;A2;A5;;;A5;A2;;;;;;Mas actividades practicas y menos teoria ;;Y;;;;;;;;Y;;;;;;;;;;Y;;;;;;;;;Mas comunicacion y publicacion de las actividades ;
19;;56;1980-01-01 00:00:00;3;es;Shla5N8KWR7d5lG;Para qué?;;Y;;;;;;;;Y;;;;Y;Y;;En casi todos se menciona pero no pasa de una clase;;;Y;;;;Y;;;Y;;;;no;;no;;no;;no;;no;;no;seminario de alta gerencia;;;no;;no;;;Y;;la carrera lo amerita debido a su naturaleza;honestidad;respeto;solidaridad;compromiso;tolerancia;;Y;;;Y;;;;;;;;;;;;;;;Y;;;;;;;;;;;;;;;;;;;;;;;;;;;;;;;;;;;;;;;;;;Y;;;;;;;;;;;;;;;;;;;;;Y;;;;A1;A6;A4;A2;A3;A5;;;A2;A3;A1;A5;A4;;;Empiecen  por los profes;;Y;;;;;;;;Y;;;;;;;;;;Y;;;;;;;;;difícil  pregunta;
20;;57;1980-01-01 00:00:00;3;es;Hc5yiddZaXmENA6;;;;;Y;;;;;;Y;;;;Y;;Y;;;Y;;;Y;;;;Y;;;;No;Sí;No;Sí;No;Sí;No;Sí;No;Sí;No;Sí;No;Sí;No;Sí;No;Sí;No;Sí;Y;;Porque en el mundo de los negocios si no hay moralidad en el sentido de no jugar sucio podría haber competencia más sana y menos perjuicio económico para la sociedad por la corrupción presente en los negocios Estado-Empresa privada, entre instituciones públicas y entre entes privados.;rosponsabilidad;sociedad;honorabilidad;tolerancia;gratitud;;Y;;;Y;;;;;;;;;;;;;;;Y;;;;;;;;;;;;;;;;;;;;;;;;;;;;;;;;;;;;;;;;;Y;;Para aprender más sobre como regirse en el ámbito de los negocios;;Y;Y;;;;;;;Y;Y;;;Y;Y;;;;Y;;;;;A5;A4;A3;A6;A2;A1;;;A3;A1;A5;A2;A4;;;Inculcar la formación etica a lo último de la carrera.;;Y;;;;;;;Y;;honorabilidad;respeto;esmero;;;;;;Y;;;;Y;;;;;;;
21;;58;1980-01-01 00:00:00;3;es;EnB3efYuENvrghS;Douglas Jimenez Artavia;Y;;;;;;;;Y;;;;;Y;Y;;"DN 405
DN 381
DN 304";;;;Y;;;;Y;;;Y;;Si empresabilidad;;si Repertorio;;si practica integrativa;;;no recuerdo;; no recuerdo;Si semnario Realidad nacional;;si liderazgo;;si liderazgo;;si gerencia recursos humanos;;;;Y;;Si por supuesto, todo profesional que administre, ya sea privado o público, tiene una gran responsabilidad para la sociedad y el estado desde múltiples factores como legislación, tributación, impacto social por lo que debe ejecutar acciones y medidas acorde a ética empresarial;Equidad;Justicia;Respesto;honestidad;Solidaridad;Y;;Hacer los correcto cuando se aplcian examentes (no copiar, no usar forros, no ayudarce con celulares, etc);;Y;;;;;;;;;;;;;;;Y;;;;;;;;;;;;;;;;;;;;;;;;;;;;;;;;;;;;;;;;;Y;;Es vital para la competitividad y neceseario que permanezca la etica en los negocios;Y;;Y;;;;Y;;Y;;Y;Y;;;Y;;;;Y;;;;;A2;A1;A6;A4;A3;A5;;;A3;A1;A2;A5;A4;;;casos practicos relacionada al amateria que se esta impartiendo ;Y;;Y;;;;;;Y;;calidad;inovacion;integridad;solidaridad;perseverancia;;;;;Y;;;;;;;;;"Seminarios
Cronograma de actividades temáticas destinadas según el valor
";Constante revisión del programa ético y reinvención según la actualidad de los negocios
22;;59;1980-01-01 00:00:00;3;es;RXrmKJkGujcpIzF;Erick Fabian Guzman;;;Y;Y;;;;;Y;;;;;Y;Y;;"Cursos de Conta
Auditoria
Control Interno";;;Y;;;;Y;;;;Y;;;No;;No;;No;;No;;No;;No;Auditoria;;Auditoria;;Auditoria;;;;Y;;La carrera de Contaduria Publica, se basa en la Fe Pública, lo que digamos como contadores debe basarse con base en resultados reales y no maquillados.;Honestidad;Responsabilidad;Transparencia;Puntualidad;Importancia de la carrera;;Y;;;Y;;A3;A2;A4;A1;;;A4;A2;A1;A3;;;;Y;;;;;;;;;;;;;;;;;;;;;;;;;;;;;;;;;;;;;;;;;Y;;Por que es importante siempre tener este tema al día y recodarselo a las personas;;Y;;Y;;;;;Y;;Y;Y;Y;Y;Y;;;;;;Y;;;A6;A4;A1;A3;A2;A5;;;A2;A1;A4;A3;A5;;;;;Y;;;;;;;;Y;;;;;;;;;;Y;;;;;;;;;Recordarlos por medio de pancartas en las aulas y pasillos;
