104;;235;1980-01-01 00:00:00;3;es;OAqWQ0FbD2f106e;GABRIEL BRAIS UGALDE;Y;;;;;;;;Y;;;;;Y;Y;;EN VARIOS PERO POR AHORA EL QUE ME LLEGA EN MENTE ES PRÁCTICA INTEGRATIVA Y LIDERAZGO ;;;Y;;;;Y;;;Y;;;;NO;;NO;SI PRACTICA INTEGRATIVA;;SI EMPRESARIEDAD;;SI PRACTICA INTEGRATIVA;;;NO;;NO;SI PRACTICA INTEGRATIVA;;;NO;;;Y;;SIENTO QUE EN LOS NEGOCIOS ES UNO DE LOS FACTORES MÁS IMPORTANTES Y GENERA RELACIONES A LARGO PLAZO ;ÉTICA;SOLIDARIDAD;TOLERACIA ;IGUALDAD ;RESPETO ;;Y;;;Y;;;;;;;;;;;;;;;Y;;;;;;;;;;;;;;;;;;;;;;;;;;;;;;;;;;;;;;;;;;;NO SE HA PRESENTADO LA OPORTUNIDAD;Y;;;;;Y;;Y;Y;;Y;;;;Y;;;;;Y;;;;A6;A2;A4;A5;A1;A3;;;A2;A3;A1;A5;A4;;;MEJORES PROFESIONALES Y UN FUTURO CON SOLIDEZ EMPRESARIAL Y MEJORA DEL MERCADO;Y;;;;Y;;;;;Y;;;;;;;;;Y;;;;Y;Y;;Y;;;HAY QUE MEJORAR LA PARTE INFORMATIVA DE LOS PROYECTOS EN EJECUCIÓN Y ADEMÁS MOTIVAR MÁS A LOS PROFESORES SOBRE EL TEMA;
105;;236;1980-01-01 00:00:00;3;es;zwRPcCxq7ceK33p;Caroll Adriana Solano Lopez;;;;Y;;;;;;Y;;;;Y;Y;;;;;Y;;;;Y;;;Y;;;;no;;no;;no;;no;trabajo comunal;;;no;;no;;no;;no;;;Y;;Porque los contadores públicos vamos a tener fe publica y tenemos que ser éticos en todos los ámbitos ya que tenemos responsabilidades grandes;etica;responsabilidad;trabajo en equipo;tolerancia;solidaridad;;Y;;;Y;;A3;A4;A2;A1;;;A1;A2;A3;A4;;;;Y;;;;;;;;;;;;;;;;;;;;;;;;;;;;;;;;;;;;;;;;;Y;;es muy importante la aplicación de la ética para evitar corrupción;;;Y;;;;Y;;;;Y;Y;Y;Y;Y;;;;;Y;;;;A2;A1;A4;A3;A6;A5;;;A3;A2;A4;A5;A1;;;que brinden talleres o cursos sobre este tema;;Y;;;;;;;;Y;;;;;;;;;;Y;;;;;;;;;;
106;;239;1980-01-01 00:00:00;3;es;dIinDHO_G4YbibO;JESSIE CORRALES MORA;;;;Y;;;;;;Y;;;;Y;;Y;;;;Y;;;;Y;;;Y;;;;NO;;NO;;NO;;NO;SI;;SI;;;NO;;NO;;NO;;;Y;;POR QUE ES PARTE DE LA EDUCACIÓN INTEGRAL QUE DEBE RECIBIR TODO PROFESIONAL;HONESTIDAD;TOLERANCIA;;;;;Y;;Y;;ASOCIACIÓN DE GUÍAS Y SCOUTS DE COSTA RICA;A2;A4;A3;A1;;;A2;A4;A3;A1;;;Y;;TALLER;ETICA PROFESIONAL;COLEGIO TECNICO DE EDUCACION COMERCIAL Y DE SERVICIOS;SAN JOSE;;;;;;;;;;;;;;;;;;;;;;;;;;;;;;;;;;;;;Y;;;;;Y;;;Y;;;;;;Y;Y;Y;;;;;;;Y;;;A1;A2;A4;A6;A5;A3;;;A5;A3;A2;A1;A4;;;;Y;;;;Y;Y;;;;Y;;;;;;;;;;Y;;;;;;;;;INCLUSIÓN DE OTRAS ACTIVIDADES EDUCATIVAS EN LOS CURSOS PRINCIPALES DE CADA CARRERA;.
107;01ESRF;;;;;;ANDREY GÓMEZ CASTRO;Y;;;;;;;;Y;;;;;Y;Y;;ECONOMÍA INTERNACIONAL, LIDERAZGO;;;Y;;;Y;;;;;Y;;;NO;;NO;;NO;;NO;;NO;;NO;SI;;SI;;SI;;;;Y;;ACTUALMENTE, HAY MUCHO PROBLEMAS RELACIONADOS CON LA FALTA DE ÉTICA.;HONESTIDAD;SINCERIDAD;respeto ;HUMILDAD;RESPONSABILIDAD;;Y;;Y;;TCU;A5;A2;A1;A4;A3;;A4;A2;A1;A3;;;;Y;;;;;;;;;;;;;;;;;;;;;;;;;;;;;;;;;;;;;;;;;Y;;PORQUE ES IMPORTANTE ESTAR EN CONSTANTE CONOCIMIENTO;;Y;;;;;;;;Y;;Y;;Y;Y;;;Y;;;;;;A3;A4;A2;A6;A5;A1;;;A4;A3;A2;A5;A1;;;;;Y;;;;;;;Y;;PRUDENCIA;TOLERANCIA;ALEGRÍA;INTEGRIDAD;PERSEVERANCIA;SOLIDARIDAD;;;;Y;;;;;;;;;CHARLAS Y CONFERENCIAS;
108;02ESRF;;;;;;CONSTANZA MENESES LÓPEZ;Y;;;;;;;;Y;;;;Y;;Y;;ECONOMÍA INTERNACIONAL;;;Y;;Y;;;;Y;;;;;NO;;NO;;NO;;NO;;NO;;NO;;NO;SI;;SI;;;NO;Y;;ACTUALMENTE HAY MUCHA CORRRUPCIÓN Y ESTA ES UNA FORMA DE COMBATIRLA;TRANSPARENCIA;PROACTIVIDAD;RESPONSABILIDAD;RESPETO;SOLIDARIDAD;;Y;;;Y;;;;;;;;;;;;;;;Y;;;;;;;;;;;;;;;;;;;;;;;;;;;;;;;;;;;;;;;;;Y;;PORQUE TODO TIPO DE CONOCIMIENTO ES BIEN RECIBIDO;;;Y;;;;;;Y;;;Y;;;Y;;;;;Y;;;;A3;A5;A2;A1;A6;A4;;;A2;A4;A1;A3;A5;;;MEDIANTE LA ELABORACIÓN DE CASOS FICTICIOS;;Y;;;;;;;Y;;PRUDENCIA;TOLERANCIA;SOLIDARIDADA;INTEGRIDAD;PERSEVERANCIA;ALEGRÍA;;;;Y;;;;;;;;;;
109;03ESRF;;;;;;NATASHA SCORSONE ZAPATA;Y;;;;;;;;Y;;;;Y;;Y;;GERENCIA DE RECURSOS HUMANOS Y LIDERAZGO;;;Y;;;;Y;;;;Y;;;NO;;NO;;NO ;SI;GERENCIA DE RECURSOS HUMANOS;ISI;RELACIONES HUMANAS;NO;;SI;RECURSOS HUMANOS, LIDERAZGO;SI;RECURSOS HUMANOS Y LIDERAZGO;SI;RECURSOS HUMANOS Y LIDERAZGO;;;Y;;YA QUE UN ADMINISTRADOR VA A CONTAR CON GRANDES RESPONSABILIDADES EN EL TRABAJO QUE DEBE REALIZAR CON ÉTICA;RESPETO;HONESTIDAD;PERSEVERANCIA;FELICIDAD;;;Y;;;Y;;;;;;;;;;;;;;;Y;;;;;;;;;;;;;;;;;;;;;;;;;;;;;;;;;;;;;;;;;Y;;PARA SER UNA MEJOR PROFESIONAL Y DESARROLLAR DE LA MEJOR MANERA MI TRABAJO;;;Y;;;Y;;;;;Y;Y;;;;;;Y;;Y;Y;;;A2;A1;A3;A4;A5;A6;;;A5;A1;A2;A4;A3;;;REALIZAR TALLERES QUE ENSEÑEN Y PONGAN EN PRÁCTICA LA ÉTICA;;Y;;;;;;;;Y;;;;;;;;;;Y;;;;;;;;;REALIZAR CONFERENCIAS Y CHARLAS;
110;04ESRF;;;;;;ANDRÉS CABEZAS BASTOS;Y;;;;;;;Y;;;;;;Y;Y;;GERENCIA DE BASE DE DATOS, INTRODUCCIÓN A LOS NEGOCIOS Y GERENCIA DE RECURSOS HUMANOS;;;Y;;;;Y;;;Y;;;SÍ;;;NO;;NO;SI;;;NO;;NO;;NO;SI;;SI;;;;Y;;PARA EVITAR DELITOS Y PROBLEMAS LEGALES;HONESTIDAD;Transparencia ;respeto ;PROFESIONALIDAD;HUMILDAD;;Y;;;Y;;;;;;;;;;;;;;;Y;;;;;;;;;;;;;;;;;;;;;;;;;;;;;;;;;;;;;;;;;Y;;PARA MEJORAR CON ESTE ASPECTO;;;;Y;;Y;;;;;;Y;;Y;Y;;;;;;Y;;;A1;A6;A3;A4;A2;A5;A7;;A1;A5;A2;A3;A4;;;TRABAJARLA MEDIANTE CASOS Y TOMA DE DECISIONES;;Y;;;;;;;;Y;;;;;;;;;;Y;;;;;;;;;ACTIVIDADES GRUPALES Y DE RELACIONES HUMANAS;
111;05ESRF;;;;;;VIVIANA CASTILLO BENAVIDES;Y;;;;;;;;Y;;;;Y;;;Y;;;;Y;;;Y;;;;Y;;;;NO;;NO;;NO;SI;INTRODUCCIÓN A LA ADMINISTRACIÓN;;NO;;NO;;NO;;NO;SI;VENTAS;;;Y;;COMO PERSONAS ÉTICAS NO PODRÍAMOS BRINDAR BENEFICIOS A LA COMPAÑÍA EN LA QUE SE TRABAJA. UNA PERSONA SIN ÉTICA CAUSARÁ MÁS PROBLEMAS QUE SOLUCIONES ;SINCERIDAD;RESPONSABILIDAD;SOLIDARIDAD;RESPETO;;;Y;;;Y;;;;;;;;;;;;;;;Y;;;;;;;;;;;;;;;;;;;;;;;;;;;;;;;;;;;;;;;;;Y;;ES PRIMORDIAL PORQUE EN EL DÍA A DÍA SE VAN A PRESENTAR SITUACIONES EN LAS QUE SE QUERRÁ ACTUAR SIN ÉTICA. ES IMPORTANTE RECONOCER LAS REPERCUSIONES DE NUESTROS ACTOS Y CÓMO ARREGLARLO.;;;Y;;;;;Y;;;;Y;Y;;Y;;;;;Y;;;;;A5;A2;A1;A3;A4;A6;;A2;A3;A4;A5;A1;A6;;CADA UNO DEBE DE TENER UNA REACCIÓN DE ÉTICA EN CADA TEMA QUE SE ABORDA. TODO CURSO SE PUEDE PRESTAR PARA HABLAR DE ÉTICA PROFESIONAL ;Y;;;Y;;;;;;Y;;;;;;;;;;Y;;;;;;;;;ES NECESARIO FORMAR A LOS ESTUDIANTES DE UNA MANERA INTERACTIVA YA QUE DE SI NO NO LES LLAMARÍA LA ATENCIÓN;
112;06ESRF;;;;;;BRIAN HARRINGTON MASÍS;Y;;;;;;;;Y;;;;;Y;Y;;;;;Y;;;;Y;;;;Y;;SÍ;SEMINARIO DE REALIDAD NACIONAL;SÍ;SEMINARIO DE REALIDAD NACIONAL;SI;SEMINARIO DE REALIDAD NACIONAL;SÍ;NO ME ACUERDO;;NO;;NO;SI;;SI;;SI;;;;Y;;;HONESTIDAD;RESPOSABILIDAD;EMPATÍA ;RESPETO;PERSEVERANCIA;Y;;PLAGIO POR PARTE DE ALGÚN ESTUDIANTE;;Y;;;;;;;;;;;;;;Y;;;;;;;;;;;;;;;;;;;;;;;;;;;;;;;;;;;;;;;;;;Y;;ES PARTE IMPORTANTE DE LA FORMACIÓN;;;Y;;;Y;;;;;Y;;;Y;Y;;;;;;Y;;;A1;A4;A3;A2;A6;A5;A7;;A1;A2;A3;A4;A5;;;;;Y;;;Y;Y;;;;Y;;;;;;;;;;Y;;;;;;;;;;
113;07ESRF;;;;;;MARIELA GUTIÉRREZ GREEN;Y;;;;;;;;Y;;;;;Y;Y;;;;;;Y;;;Y;;;;Y;;;NO;;NO;;NO;;NO;;NO;;NO;;NO;;NO;;NO;;;Y;;ES NECESARIA;RESPETO;HONESTIDAD;EMPATÍA ;tolerancia;PUNTUALIDAD;;Y;;;Y;;;;;;;;;;;;;;;Y;;;;;;;;;;;;;;;;;;;;;;;;;;;;;;;;;;;;;;;;;Y;;ES NECESARIO;;;Y;;;;;;;Y;Y;Y;;Y;;;;;;Y;;;;A1;A5;A6;A2;A3;A4;;;A2;A5;A4;A1;A3;;;TALLERES DINÁMICOS DE ÉTICA;;Y;;;;;;;;Y;;;;;;;;;;;;;;;;;;;;
114;08ESRF;;;;;;LUIS MARQUÉZ PORRAS;Y;;;;;;;;Y;;;;;Y;Y;;ECONOMÍA Y FINANZAS;;;Y;;;;;Y;;Y;;;;NO;;NO;;NO;;NO;;NO;;NO;;NO;SI;;SI;NO;;;Y;;PARA QUITAR LA CORRUPCIÓN;TRANSPARENCIA;SOLIDARIDAD;respeto ;HUMILDAD;TOLERANCIA;;Y;;;Y;;;;;;;;;;;;;;;Y;;;;;;;;;;;;;;;;;;;;;;;;;;;;;;;;;;;;;;;;;Y;;ES NECESARIO;Y;;;;;Y;;;;;Y;;Y;Y;;;;;;;;Y;;;A4;A3;A2;A1;A5;A6;;A2;A1;A3;A4;A5;;;;;Y;;;;;;;;Y;SOLIDARIDAD;EMPRENDEDURISMO;RESPETO;HONESTIDAD;PRUDENCIA;INTEGRIDAD;ALEGRÍA;PERSEVERANCIA;;Y;;;;;;;;;;
115;09ESRF;;;;;;KAREN DIXON HAMBELANT;Y;;;;;;;;Y;;;;;;Y;;ENTORNO LEGAL 1 Y 2, GERENCIA DE SISTEMAS DE BASE DE DATOS;;;Y;;;Y;;;;Y;;;;NO;SI;;SI;;SI;;SI;NO;;NO;SI;NO;;NO;;;;;Y;;ES DE VITAL IMPORTANCIA PARA DESARROLLARSE COMO PROFESIONAL, TENER CONFIANZA EN LOS DEMÁS Y VICEVERSA;RESPETO;TOLERANCIA;RESPONSABILIDAD;PAZ;HONESTIDAD;;Y;;;Y;;;;;;;;;;;;;;;Y;;;;;;;;;;;;;;;;;;;;;;;;;;;;;;;;;;;;;;;;;Y;;ES NECESARIO Y VITAL;;;Y;Y;Y;Y;;Y;;;;;Y;Y;Y;;;;;Y;;;;A6;A5;A3;A2;A1;A4;A7;;A4;A5;A1;A2;A6;A3;;HACERLO PRÁCTICO Y VIVENCIAL;;Y;;;;;;;;Y;;;;;;;;;;;;;;;;;;;IMPLEMENTAR TALLERES O CURSOS DE FORMA VIRTUAL Y CERTIFICAR AL ESTUDIANTE;
116;10ESRF;;;;;;PAMELA VALVERDE VARGAS;Y;;;;;;;;Y;;;;;Y;Y;;GERENCIA DE BASES DE DATOS, PRINCIPIOS DE GERENCIA;;;Y;;;;Y;;;;Y;;;NO ;;NO;;NO;;NO;;NO;;NO;;NO;;NO;SI;;;;Y;;PORQUE HOY EN DÍA REQUERIMOS DE MÁS SENSIBILIDAD EN DICHO TEMA PARA PODERNOS FORMAR ADECUADAMENTE Y MOSTRAR UNA IMAGEN PROFESIONAL DE MAYOR EXCELENCIA;;;;;;;Y;;;Y;;;;;;;;;;;;;;;Y;;;;;;;;;;;;;;;;;;;;;;;;;;;;;;;;;;;;;;;;;Y;;PARA OBTENER MAYOR CONOCIMIENTO;;;Y;;;Y;;;;;Y;Y;;;;;;;;Y;;;;A6;A2;A4;A1;A3;A5;;;A5;A3;A4;A2;A1;;;;;Y;;;;;;;;Y;;;;;;;;;;Y;;;;;;;;;MAYOR INTEGRACIÓN DE LOS ESTUDIANTES;
117;11ESRF;;;;;;MARÍA SALAZAR ALVARADO;Y;;;;;;;;Y;;;;;Y;;Y;;;;Y;;;;Y;;;Y;;;;NO;;no;;NO;;NO;;NO;;NO;SI;INTRODUCCIÓN A LAS TECNOLOGÍA DE INFORMACIÓN;;NO;SI;;;;Y;;PORQUE LA ÉTICA ES UN TEMA TRANSVERSAL QUE INCIDE EN TODAS LAS DECISIONES QUE SE TOMEN ;Responsabilidad;COMPROMISO;PUNTUALIDAD;TRANSPARENCIA ;PRODUCTIVIDAD;;Y;;;Y;;;;;;;;;;;;;;;Y;;;;;;;;;;;;;;;;;;;;;;;;;;;;;;;;;;;;;;;;;;Y;;;;;;;;;;;;;;;;;;;;;Y;;;;A1;A4;A3;A2;A5;A6;A7;;A3;A2;A4;A5;A1;;;;CONSIDERO QUE LA ETICA ES UN TEMA QUE SE FORMA DESDE EL NÚCLEO FAMILIAR DE CADA PERSONA, POR LO QUE ES DIFICIL CAMBIAR LA PERPSPECTIVA QUE TENGA UN ADULTO AL RESPECTO. PERO SE PUEDE TRABAJAR CON CASOS HIPOTÉTICOS PARA FOMENTAR UN PENSAMIENTO CRÍTICO AL RESPECTO;Y;;;;;;;;Y;;;;;;;;;Y;;;Y;Y;;;Y;;;MANTENERLO COMO EJE TRANSVERSAL EN LA FORMACIÓN DE LOS ESTUDIANTES.;
118;12ESRF;;;;;;ALEJANDRA GUTIÉRREZ CAMPOS ;Y;;Y;;;;;Y;;;;;Y;;Y;;RECURSOS HUMANOS Y FINANZAS;Y;;;;;;Y;;;;Y;;;;;;SI;RECURSOS HUMANOS Y PRINCIPIOS DE GERENCIA ;;SI;RECURSOS HUMANOS ;;;;;;;;;;;;Y;;NECESARIO PARA SER UNA PERSONA ÍNTEGRA;PERSEVERANCIA ;HONESTIDAD;RESPONSABILIDAD;RESPETO;EMPATÍA;;Y;;;Y;;;;;;;;;;;;;;;Y;;;;;;;;;;;;;;;;;;;;;;;;;;;;;;;;;;;;;;;;;;Y;;;;;;;;;;;;;;;;;;;Y;;;;;;A5;A4;A3;A2;A1;A6;;;;;;;;;;;Y;;;;;Y;;;;Y;;;;;;;;;;;;;;;;;;;ACTIVIDADES;
119;13ESRF;;;;;;GABRIELA FONSECA V;Y;;;;;;;;Y;;;;;Y;Y;;VARIOS;;;Y;;;;Y;;;Y;;;;NO;SI;;SI;NO;;NO; ;NO;SI;;SI;;SI;;;;;;Y;;ES MUY IMPORTANTE;;HONESTIDAD;;RESPETO;;Y;;;;Y;;;;;;;;;;;;;;;Y;;;;;;;;;;;;;;;;;;;;;;;;;;;;;;;;;;;;;;;;;;Y;;;;;;;;;;;;;;;;;;;;;Y;;;;A1;A2;A3;A4;A5;A6;A7;;A1;A2;A3;A4;A5;A6;;ACTIVIDADES Y DINÁMICAS;;Y;;;;;;;;Y;;;;;;;;;;Y;;;;;;;;;;
120;14ESRF;;;;;;ALVARO HERRERA SAÉNZ;Y;;;;;;;Y;;;;;Y;;Y;;RECURSOS HUMANOS, INTRODUCCIÓN A LAS TECNOLOGÍAS DE COMUNICACIÓN Y GERENCIA DE BASES DE DATOS;;;Y;;;Y;;;Y;;;;SI;;SI;NO;SI;ESTRUCTURAS DE CONTABILIDAD;;NO;SI;ECONOMÍA INTERNACIONAL  II;II;NO;;NO;;NO;;;;;;Y;EN NUESTRA CARRERA NO SE ENSEÑA MUCHO DE ÉTICA Y LOS ESTUDIANTES SE OLVIDAN TEMAS DE ÉTICA, TRATAR CON PERSONAS Y LA NECESIDAD DE LA EMPRESA;RESPETO;TOLERANCIA;;;;;Y;;;Y;;;;;;;;;;;;;;;Y;;;;;;;;;;;;;;;;;;;;;;;;;;;;;;;;;;;;;;;;;Y;;ME AYUDARÍA A SER UN MEJOR PROFESIONAL EN EL FUTURO;Y;;;;;Y;Y;;;Y;;;;;;;;;;Y;;;;A3;A4;A1;A2;A5;A6;;;A3;A1;A4;A5;A2;;;;Y;;;;;;Y;AL INICIO DE CADA CURSO VIENE EN EL PROGRAMA;;Y;;;;;;;;;;Y;;;;;;;;;;
121;15ESRF;;;;;;MÓNICA FERNÁNDEZ;Y;;;;;;;;Y;;;;;Y;Y;;RECURSOS HUMANOS, ESTRUCTURAS DE CONTABILIDAD, ECONOMÍA INTERNACIONAL ;I Y II, BASE DE DATOS Y SISTEMAS DE INFORMACIÓN GERENCIAL;;Y;;;Y;;;Y;;;;;;;;SI;PRINCIPIOS DE MERCADEO ;SI;;;;;;;;;;;;;;Y;;PORQUE EN EL ÁMBITO LABORAL NOS ENFRENTAMOS A MUCHAS SITUACIONES EN LAS QUE NUESTRA ÉTICA VA A SER COMPROMETIDA;;;;;;;Y;;;Y;;;;;;;;;;;;;;;Y;;;;;;;;;;;;;;;;;;;;;;;;;;;;;;;;;;;;;;;;;Y;;;;;Y;;;;;;Y;;;Y;;Y;Y;;;;;Y;;;;A2;A4;A3;A5;A1;A6;;;A4;A2;A1;A5;A3;;;QUE PROMUEVA FORMACIÓN ÉTICA DEL PROFESORADO;Y;;;;;;Y;PROFESOR DE ECONOMÍA INTERNACIONAL ;Y;;ALEGRÍA;RESPETO;;;;;;;;;;;;;;;;;;
122;16ESRF;;;;;;DANIELA PADILLA ROJAS;Y;;;;;;;;Y;;;;;Y;Y;;RECURSOS HUMANOS, PRINCIPIOS MERCADEO;;;Y;;;;Y;;Y;;;;;NO;;NO;;NO;;NO;;NO;;NO;;NO;;NO;;NO;;;Y;;LA ÉTICA DEBE PRIORIZARSE EN CUALQUIER CAMPO, NO ES POSIBLE HACER NEGOCIOS SIN TENER VALORES, ÉTICA, RESPONSABILIDAD SOCIAL, HAY QUE CREAR Y DESARROLLAR NEGOCIOS A LARGO PLAZO;TRANSPARENCIA;RESPETO;LEALTAD;HONRADEZ;TOLERANCIA;Y;;EL JUEGO DEL CURSO BOLSA VALORES, EN EL PORTAFOLIO MIS COMPAÑEROS QUERÍAN COMPRAR ACCIONES DE EMPRESAS MILITARES PARA APROVECHAR EL CONFLICTO QUE SE ESTABA DESATANDO, NO ESTUVE DE ACUERDO PERO FUI MINORÍA Y PERDÍ.;;Y;;;;;;;;;;;;;;;Y;;;;;;;;;;;;;;;;;;;;;;;;;;;;;;;;;;;;;;;;;Y;;CREO EN LOS VALORES, LOS PRINCIPIOS Y LA ÉTICA PARA CUALQUIER PRÁCTICA O NEGOCIO QUE SE HAGA;Y;;Y;;;;;;Y;;;;;;;;;;;;Y;;;A4;A1;A5;A6;A3;A2;A7;;A5;A2;A3;A4;A1;;;SIMULACIÓN DE SITUACIONES, RESOLUCIÓN DE CASOS, MUESTRA DE CASOS REALES CON LAS CONSECUENCIAS;Y;;;;;;Y;PROGRAMA DEL CURSO;;Y;;;;;;;;;;Y;;;;;;;;;ACTIVIDADES COMO TALLERES, SEMINARIOS;NINGUNO
123;17ESRF;;;;;;DAVID SÁNCHEZ DELGADO;Y;;;;;;;;Y;;;;;;Y;;RECOMENDACIONES DE ALGUNOS PROFES;;;Y;;;;Y;;Y;;;;;NO;;NO;;NO;;NO;;NO;;NO;;NO;;NO;;NO;SÓLO EL TCU Y GENERALES;;Y;;ES NECESARIO QUE LAS PERSONAS SE MANEJEN BAJO ALGUNAS NORMAS MORALES EN LA PROFESIÓN, DESPUÉS NOS QUEJAMOS DE LA CORRUPCIÓN;HONESTIDAD;RESPONSABILIDAD;;;;Y;;EL SIMPLE HECHO DE RESPIRAR O NO;Y;;PROYECTO DE ACCIONES SOCIALES Y VALORES CRISTIANOS;A1;A4;A3;A2;A5;MAYOR DICHA EN HACER LO CORRECTO, PAZ PERSONAL;A4;A3;A2;A1;A5;;;Y;;;;;;;;;;;;;;;;;;;;;;;;;;;;;;;;;;;;;;;;;Y;;ES CRECIMIENTO PERSONAL Y NO SÓLO PROFESIONAL;;Y;Y;Y;;;;;Y;;;;Y;;Y;;;;;Y;Y;;;A1;A2;A4;A3;A5;A6;;;A5;A1;A4;A3;A2;A6;;EJEMPLOS DE CASOS REALES;;Y;;;;;;DIAY SIMPLEMENTE NO SÉ;;Y;;;;;;;;;;Y;;;;;;;;;NO SÉ;
124;18ESRF;;;;;;CAROL HERNÁNDEZ;Y;;;;;;;;Y;;;;;Y;;Y;;;Y;;;;Y;;;;Y;;;;NO;;NO;;NO;SI;;;NO;;NO;SI;;;NO;SI;;;;Y;;ES UN TEMA QUE SIEMPRE DEBE TENER EN CUENTA EN TODO MOMENTO, TRABAJO O PROFESIÓN;HONESTIDAD;TRANSPARENCIA;RESPONSABILIDAD;RESPETO;;Y;;ACCIONES QUE HE VISTO QUE REALIZAN OTRAS PERSONAS. DEBIDO A QUE ESTA ENCUESTA NO ES CONFIDENCIAL Y PUSE MI NOMBRE AL INICIO NO PUEDO ESCRIBIR AQUÍ;;Y;;;;;;;;;;;;;;;Y;;;;;;;;;;;;;;;;;;;;;;;;;;;;;;;;;;;;;;;;;Y;;ES UN TEMA IMPORTANTE Y DESDE MI PUNTO DE VISTA EN UNA EMPRESA SE DEBE DE TENER UN BUEN CONOCIMIENTO Y MANEJO SOBRE ÉTICA;;;Y;Y;;Y;;;Y;;;Y;Y;Y;Y;;;;;Y;;;;A2;A4;A6;A1;A5;A3;;;;;;;;;;;Y;;Y;;;;;CURSOS;Y;;ALEGRÍA;RESPONSABILIDAD;;;;;;;;Y;;;;;;;;;QUE LOS MODIFIQUEN POR VALORES QUE REPRESENTEN A TODOS O LA MAYORÍA DE LOS INVOLUCRADOS PARA QUE DE ESTA FORMA LAS PERSONAS SE SIENTAN PARTE DE ESE CAMBIO Y ESA VÍA DE APLICAR LOS VALORES;ESTA ENCUESTA ESTÁ MAL ESTRUCTURADA, ES MUY CANSADO Y SE PUEDE CONFUNDIR SI LA PREGUNTA ESTÁ EN UNA PÁGINA Y LAS RESPUESTAS SE DEBEN PONER EN OTRA. DEBERÍA O SERÍA MEJOR SI NO REQUIERE EL NOMBRE COMPLETO
125;19ESRF;;;;;;STWARD M.QUESADA TREJOS;Y;;;;;;;;Y;;;;;Y;Y;;MERCADEO, ENTORNO LEGAL, RELACIONES HUMANAS, FINANZAS, ETC;;;Y;;;;Y;;;;Y;;;NO;;MO;;NO;INTRODUCCIÓN A LA ADMINISTRACIÓN;;;NO;;NO;PRINCIPIOS DE GERENCIA;;;NO;;NO;;;Y;;PORQUE UN PROFESIONAL EN GRAN PARTE SE DEBE A SUS PRINCIPIOS Y LA ETICA ES UNA IMAGEN DE ESTOS;RESPETO;HONESTIDAD;RESPONSABILIDAD;EMPATIA ;TRABAJO EN EQUIPO;;Y;;;Y;;;;;;;;;;;;;;;Y;;;;;;;;;;;;;;;;;;;;;;;;;;;;;;;;;;;;;;;;;Y;;PORQUE UN PROFESIONAL DEBE SER COMPLETO EN MUCHOS AMBITOS ;;Y;Y;;;;;Y;;;Y;Y;;;Y;;;;;Y;;;;A7;A5;A1;A4;A2;A3;A6;;A2;A5;A1;A4;A3;;;ESTABLECER ACTIVIDADES (ESCENARIOS) DONDE HAYA QUE ENFRENTARSE A ASUNTOS ETICOS;;Y;;;;;;;;Y;;;;;;;;;;Y;;;;;;;;;HACERLOS MAS PUBLICOS Y QUE FORMEN PARTE DE LA PRESENTACION DE LOS PROFESIONALES, DE ESTA FORMA NO ES NECESARIA ENVIAR CIRCULARES, PORQUE SE VIVE SOBRE LOS VALORES.;
126;20ESRF;;;;;;MARIAM CAMBRONERO AVILA;Y;Y;;;;;;Y;Y;;;;;;Y;;SI, DN0301 CON RICARDO VALVERDE, EL SIEMPRE NOS MARCABA EL CONCEPTO DE ETICA, EXCELENTE PROFESOR, SIEMPRE SALIA DE LA CLASE CON GANA DE SER MEJOR ;;;Y;;;;Y;;Y;;;;TCU;;TCU;;;DN0391;;DN0203;;DN0101;;DN0203,DN0391;;;;DN0101;;DN0203, DN0391;;;Y;;PORQUE COMO CIUDADANOS DEBEMOS TENER ETICA EN CUALQUIER AMBITO: SOCIAL, EDUCATIVO, PROFESIONAL PARA AVANZAR HACIA UN PAIS MEJOR;TRANSPARENCIA;COMPROMISO;RESPONSABILIDAD;PASION ;PACIENCIA;Y;;CLARAMENTE, TODOS ALGUNA VEZ NOS HEMOS ENFRENTADO A SUTUACIONES RELACIONADAS CON LA ETICA ;;Y;PERO ME GUSTARIA ;;;;;;;;;;;;;;Y;;;;;;;;;;;;;;;;;;;;;;;;;;;;;;;;;;;;;;;;;Y;;SI ME ENCANTARIA, QUIERO DEDICARME A UN FUTURO EN UNA EMPRESA A EJECUTAR PROYECTOS DE RSE Y ACTUALMENTE ESTOY REALIZANDO UNA CAUSA SOCIAL QUE ME HA LLENADO BASTANTE;Y;Y;Y;Y;;Y;Y;Y;Y;;Y;Y;Y;Y;Y;;;Y;;;;Y;PARA LA BUSQUEDA DEL BIEN COMUN Y TENER JUSTICIA;A2;A3;A5;A4;A7;A6;A1;SENTIRME BIEN CON MIGO MISMA PORQUE MI CONSCIENCIA ME CARCOME CUANDO HAGO ALGO INCORRECTO;A1;A5;A4;A3;A2;;;MAS TALLERES Y SEMINARIOS. EN LOS CURSO QUE LOS PROFESORES HAGAN VER LA IMPORTANCIA DE LA MISMA.;;Y;;;;;;;Y;;¿ALEGRIA? DE HECHO MOLES TAMOS CON ESO YA QUE NO ES UN VALOR;RESPONSABILIDAD ;COMPROMISO;;;;;;;Y;;;;;;;;;TALLERES, SEMINARIOS;GRACIAS
127;21ESRF;;;;;;CATHERINE MICHELLE GOMEZ BOLAÑOS;Y;;;;;;;;Y;;;;;Y;;Y;;;Y;;;;Y;;;;Y;;;;NO;;NO;;NO;;NO;;NO;;NO;BASE DE DATOS, ENTORNO LEGAL;;;NO;;NO;;NO;Y;;ES NECESARIO COMO PROFESIONALES ESTAR CONSIENTES SOBRE ESTOS TEMAS PARTICULARMENTE PORQUE SON VIVIDOS REALMENTE EN CUALQUIER CAMPO PROFESIONAL, DESDE EL TRATAMIENTO CON COMPAÑEROS HASTA CADA FAMILIA, GRUPO DE TRABAJO, ETC;TRANSPARENCIA;RESPETO;RESPONSABILIDAD;HONESTIDAD;;;Y;;;Y;;;;;;;;;;;;;;;Y;;;;;;;;;;;;;;;;;;;;;;;;;;;;;;;;;;;;;;;;;Y;;CON LA FINALIDAD DE ADQUIRIR MAS CONOCIMIENTO DEL TEMA, ASIMISMO PARA TENER BASES QUE ME PERMITAN ADAPTARME O SOBRELLEVAR UN TEMA DE ETICA EN EL MERCADO LABORAL EN EL QUE ME DESEMBUELVA;Y;;;;;Y;;;;;Y;Y;;;;;;;;Y;;;;A5;A1;A2;A3;A4;A6;;;A2;A1;A4;A3;A5;;;INTEGRAR EN CADA CLASE TEMAS RELACIONADOS A LA EXOPERIENCIA DE LOS PROFESORES SOBRE TEMA DE ETICA, ASI COMO MAYOR DESARROLLO DEL MISMO;;Y;;;;;;;;Y;;;;;;;;;;Y;;;;;;;;;GENERAR ACTIVIDADES QUE DEN A ENTENDER LA EXISTENCIA DE DICHOS VALORES Y CON QUE OBJETIVOS SON DESARROLLADOS PRINCIPALMENTE EN ACTIVIDADES DE LA ESCUELA;
128;22ESRF;;;;;;JUAN PABLO MASIS RODRIGUEZ;Y;;;;;;;;Y;;;;;Y;Y;;EN LOS CURSOS SOBRE GERENCIAS DE MERCADEO, PUBLICIDAD, Y EN GENERAL EN CASI QUE EN TODOS LOS CURSO ESTA COMO EJE TRANSVERSAL, COMO EN ENTORNO LEGAL;;;Y;;;;Y;;;Y;;;;NO;;NO;;NO;;NO;;NO;;NO;;NO;;NO;SI;;;NO;;;EN TODO AMBITO PROFESIONAL, LA ETICA DEBE ESTAR PRESENTE SI SE QUIERE EN COSTA RICA UNA SOCIEDAD SIMENTADA BAJO PRINCIPIOS Y VALORES, SOBRE TODO EN EL CONTEXTO EMPRESARIALÑ DONDE EXISTEN UN SINFÍN DE DILEMAS ETICOS;HONESTIDAD;SINCERIDAD;EMPATIA;RESPETO;LABORIOSIDAD;Y;;POR EJEMPLO A REALIZAR INVESTIGACIONES COMPLEJAS, EN VARIAS OCACIONES TUVE QUE EVITAR EL PLAJIO;;Y;;;;;;;;;;;;;;;Y;;;;;;;;;;;;;;;;;;;;;;;;;;;;;;;;;;;;;;;;;;;;;;;;;;;;;;;;;;;;;;;;Y;;;A1;A5;A3;A2;A6;A4;A7;;A5;A1;A3;A2;A4;;;DEDICAR TODA UNA SESION DE CADA CURSO DEL PLAN, PARA TRATAR TEMAS ETICOS RELATIVOS A LA MATERIA QUE CADA DETERMINADO CURSO ABARQUE (ALGUNOS DE LOS CURSOS YA LO HACEN, MAS NO TODODOS);Y;;Y;Y;;;;;Y;;INTEGRIDAD;TOLERANCIA;RESPETO;HONESTIDAD;SOLIDARIDAD;;;;;Y;;;;;;;;;REALIZAR ACTIVIDADES LUDICAS A MANERA DE TALLERES CORTOS;
129;23ESRF;;;;;;HUGO CARMONA ESPINOZA;Y;;;;;;;;Y;;;;Y;;Y;;ECONOMIA INTERNACIONAL II, ENTORNO LEGAL DE LAS EMPRESAS I Y II ;;;Y;;;Y;;;;;Y;;;NO;;NO;ECONOMIA INTERNACIONALII;;ECONOMIA INTERNACIONAL II;;;NO;;NO;ECONOMIA INTERNACIONAL II Y ENTORNO LEGAL I Y II;;;NO;ECONOMIA INTERNACIONAL II Y ENTORNO LEGAL I Y II;;;;Y;;PORQUE EN NUESTROS FUTUROS TRABAJOS ACTUAR FUERA DE LA ETICA PODRIA COSTARNOS EL PUESTO O INCLUSO LA LI8BERTAD;HUMANISMO;RESPONSABILIDAD;COMPAÑERISMO;RESPETO;OBJETIVIDAD;Y;;POR EJEMPLO DETERMINAR IRREGULARIDADES EN EVALUACIONES COMO LO SON PERSONAS COPIANDO Y EN DICHOS EXAMENES O QUICES Y HE VISTO QUE HAY PROFESORES QUE PRESENTAN FAVORITISMO A UNAS ESTUDIANTES;;Y;;;;;;;;;;;;;;;Y;;;;;;;;;;;;;;;;;;;;;;;;;;;;;;;;;;;;;;;;;Y;;PORQUE ES UN TEMA IMPORTANTE NO SOLO EN  LA VIDA PERSONAL Y NO SOLO EN LA PROFESIONAL;;;Y;Y;;Y;;Y;;;Y;Y;Y;;Y;;;;;Y;;;;A5;A3;A1;A2;A4;A6;;;A2;A5;A3;A4;A1;;;CAPACITAR A LOS PROFESORES, PERO PRINCIPALMENTE LOS QUE SE HAN VISTO ENVUELTOS EN DILEMAS ETICOS Y O INVESTIGO AQUELLOS ESTUDIANTES QUE HAN SEÑALADO;;Y;;;;;;;Y;;ALEGRIA;EMPRENDEDURISMO;SOLIDARIDAD;;;;;;;Y;;;;;;;;;ELIMINAR LA ALEGRIA COMO VALOR Y APORTAR OTRAS QUE FOMENTEN SERIEDAD Y COMPAÑERISMO;OJALA HACER INVESTIGACIONES SOBRE FUNCIONARIOS QUE SE MURMUREN SE HAYAN VISTO ENVUELTOS EN DILEMAS ETICOS 
130;24ESRF;;;;;;LOANA THÜEL COTO;Y;;;;;;;Y;;;;;;Y;Y;;GERENCIA DE RECURSOS HUMANOPS, GERENCIA DE BASES DE DATOS E INTRODUCCION A LA ADMINISTRACION DE NEGOCIOS ;;;Y;;;Y;;;Y;;;;;NO;SEMINARIO DE REALIDAD NACIONAL;;;NO;INTRODUCCIÓN A LA ADMINISTRACIÓN;;;NO;;NO;;NO;;NO;;NO;;;Y;;ES DE SUMA IMPORTANCIA MAS PARA UN GERENTE, YA QUE SE DEBE CONVIVIR A DIARIO CON SITUACIONES EN LAS QUE HAY QUE TOMAR DESICIONES Y LA ETICA TOMA UN PAPEL FUNDAMENTAL, YA QUE INCLUSIVE SE PUEDE CAER EN POBLEMAS LEGALES.;HONESTIDAD;TOLERANCIA;COMPROMISO;INTEGRIDAD;RESPETO ;Y;;PLAJIOS DE TRABAJOS UNIVERSITARIOS, COPIAR EN EXAMENES, TRABAJAR EN EQUIPO Y CUMPLIR CON LAS FUNCIONES/ ACTIVIDADES ASIGNADAS;;Y;;;;;;;;;;;;;;;Y;;;;;;;;;;;;;;;;;;;;;;;;;;;;;;;;;;;;;;;;;Y;;COMO SE HA MENCIONADO ANTERIORMENTE, LA ETICA ES FUNDAMENTAL PARA LA FORMACIONM DE TODO PROFESIONAL, Y AUN MAS PARA UN FUTURO GERENTE;Y;;Y;;;Y;;Y;;;Y;Y;;;Y;;;;;;Y;;;A2;A4;A3;A1;A5;A6;A7;;A2;A1;A3;A5;A4;A6;;ADEMAS DE REALIZAR UN CURSO RELACIONADO A ETICA, ME PARECE QUE ES UN TEMA QUE DEBE SER TRATADO EN LA MAYORIA DE LOS CURSOS QUE SE IMPARTEN DENTRO DE LA ESCUELA;Y;;;;;Y;;;Y;;ETICA;ALEGRIA;RESPETO;;;;;;;Y;;;;;;;;;ACTIVIDADES PARA FORTALECERLOS Y FOMENTARLOS DENTRO DEL PROFESORADO Y LA ORGANIXACION EN GENERAL.;
131;25ESRF;;;;;;SILVIA VARELA MOLINA ;Y;;;;;;;Y;;;;;;Y;Y;;GERENCIA DE RECURSOS HUMANOS, GERENCIA DE BASES DE DATOS Y PRINCIPIOS DE GERENCIA;;;Y;;;Y;;;Y;;;;;NO;;NO;;NO;INTRODUCCIÓN A LA ADMINISTRACIÓN;;;NO;;NO;;NO;;NO;;NO;;;Y;;PORQUE NO IMPORTA LA PROFESIÓN O ÁREA DE INTERÉS, TENER INTEGRIDAD Y ESTAR COMPROMETIDOS NOS PERMITE EVITAR CAER EN PROBLEMAS LEGALES Y MEJORAR LAS RELACIONES EN LAS EMPRESAS;INTEGRIDAD;TOLERANCIA;RESPETO;HONESTIDAD;COMPROMISO;Y;;EVITAR EL PLAGIO DE LOS TRABAJOS, NO COPIAR EN LOS EXÁMENES Y RESPETAR A LOS COMPAÑEROS SIN IMPORTA GÉNERO, PENSAMIENTO, ETC.;;Y;;;;;;;;;;;;;;;Y;;;;;;;;;;;;;;;;;;;;;;;;;;;;;;;;;;;;;;;;;Y;;ME ENSEÑARÍA A TENER FUERZA DE VOLUNTAD ANTE SITUACIONES QUE NO SEAN CORRECTAS;;;;Y;;;Y;Y;;;Y;Y;;;Y;;;;;Y;;;;A1;A3;A5;A2;A6;A4;;;A3;A1;A2;A5;A4;;;;Y;;;;;Y;;;;Y;;;;;;;;;;;;Y;;;;;;;PROGRAMAS QUE INVOLUCREN PROFESORES, ESTUDIANTES Y ADMINISTRATIVOS PARA COMPARTIR VALORES Y EXPERIENCIAS LABORALES DONDE SU ÉTICA SE VIO DESAFIADA;
132;26ESRF;;;;;;JENIFFER ALVARADO;Y;;;;;;;;Y;;;;;Y;Y;;SE MENCIONÓ EN GRAN PARTE LOS CURSOS AL INICIO DE LA CARRERA EN RECURSOS HUMANOS, TECNOLOGÍA, CONTABILIDAD, FINANZAS, ENTORNO, INCLUSIVE LA ESCUELA IMPARTE SEMINARIOS;;Y;;;;Y;;;;Y;;;SEMINARIO DE REALIDAD NACIONAL II;;SEMINARIO DE REALIDAD NACIONAL II;;;NO;TCU;;TCU;;TCU;;RELACIONES HUMANOS EN EL ENTORNO EMPRESARIAL;;RELACIONES HUMANAS EN EL CONTEXTO EMPRESARIAL;RELACIONES HUMANAS EN EL CONTEXTO EMPRESARIAL, LIDERAZGO;;;;;Y;;SE TRABAJA EN UN ENTORNO ES IMPORTANTE PUES SE MANEJÓ RELACIONES CON LAS PERSONAS TANTO DE FORMA INTERNO COMO EXTERNA SI TODO EMPLEA PRÁCTICAS ÉTICAS EL DESARROLLO DEL MERCADO SERÁ PRODUCTIVO Y A NIVEL PERSONAL LAS COSAS SALEN BIEN Y SATISFACEN, ADEMÁS DA EJEMPLO A OTROS;RESPETO;TRANSPARENCIA;HUMILDAD;COOPERATIVIDAD;;Y;;CON TRABAJO DE INVESTIGACIÓN;;Y;;;;;;;;;;;;;;Y;;CURSO EN LÍNEA;BIOÉTICA;;WEB;2014;;;;;;;;;;;;;;;;;;;;;;;;;;;;;;;;;;;;Y;;CRECIMIENTO PROFESIONAL, NO SOMOS MÁQUINAS Y SOBRETODO QUE TRABAJAMOS CON PERSONAS;;Y;Y;;;;Y;;;;Y;Y;Y;Y;Y;;;;;Y;;;;;A5;A6;A3;A1;A2;A4;;A5;A4;A3;A2;A6;A1;;OFRECER MAYOR CANTIDAD DE SEMINARIOS E ILUSTRAR CASOS REALES;;Y;;;;;;;;Y;;;;;;;;;;Y;;;;;;;;;PARA EMPREZAR A MEJORAR LA PROMOCIÓN E INVOLUCRAR A TODOS LOS MIEMBROS EN ACTIVIDADES PROFESIONALES, ESTUDIANTES Y ADMINISTRATIVOS;
133;27ESRF;;;;;;MARÍA ANGÉLICA MATA;Y;;;;;;;;Y;;;Y;;;;Y;;;Y;;;;;Y;;Y;;;;;NO;SI;;;NO;;NO;;NO;;NO;;NO;;NO;;NO;SI;;Y;;PARA SER BUEN PROFESIONAL SE DEBE SER ÉTICO CON TODO;RESPONSABILIDAD;DISCIPLINA;PASIÓN;HONESTIDAD;;Y;;;;Y;;;;;;;;;;;;;;;Y;;;;;;;;;;;;;;;;;;;;;;;;;;;;;;;;;;;;;;;;;Y;;NUNCA HAY CONOCIMIENTOS QUE SOBREN, SIEMPRE ES IMPORTANTE SABER MÁS;;;;Y;;;;Y;Y;;Y;;;;;Y;POLÍTICAS DE SEGURIDAD;;;Y;;;;A5;A6;A2;A4;A1;A3;;;A5;A3;A2;A4;A1;;;;;Y;;;;;;;;Y;;;;;;;;;;Y;;;;;;;;;MAYOR DIFUSIÓN;
134;28ESRF;;;;;;JOSÉ MARIO CASTRO ORTIZ;Y;;;;;;;;Y;;;;Y;;Y;;PRINCIPIOS DE GERENCIA, GERENCIA DE RRHHH, PRINCIPIOS DE CONTABILIDAD, ESTRUCTURAS DE CONTABILIDAD, CURSOS DE MERCADEO;;;;Y;;;Y;;;Y;;;SEMINARIO DE REALIDAD NACIONAL ;;SEMINARIO DE REALIDAD NACIONAL;;LIDERAZGO GERENCIAL;;;NO;;NO;;NO;PRINCIPIOS DE GERENCIA;;;NO;;NO;;;Y;;LA ÉTICA ES DE ESPECIAL IMPORTANCIA, CONSIDERANDO QUE EN EL MERCADO LABORAL SE INTERACTÚA CON LOS COLABORADORES Y CON ASPECTOS LEGALES QUE SE DEBEN RESPETAR, LA IDEA ES INTERIORIZAR ESA CONCIENCIA;TRANSPARENCIA;RESPONSABILIDAD;RESPETO;EMPATÍA;;;Y;;;Y;;;;;;;;;;;;;;;Y;;;;;;;;;;;;;;;;;;;;;;;;;;;;;;;;;;;;;;;;;Y;;PODRÍA LLEGAR A SER DE UTILIDAD TANTO PARA EL DESARROLLO PERSONAL COMO PROFESIONAL DONDE TRABAJE;;;Y;;;;Y;;;;;;;;Y;;;;;Y;;;;A3;A4;A6;A5;A2;A1;A7;;A5;A1;A2;A4;A3;A6;;QUE SE ENGLOBEN EN LA TOTALIDAD DE LOS CURSOS, PARA DAR UN PUNTO DE VISTA ÉTICO INTEGRALMENTE;Y;;;;;Y;;;;Y;;;;;;;;;;Y;;;;;;;;;ACTIVIDADES EN LAS QUE CUBRA EL TEMA DE LA ÉTICA, ADCIONAL AL EJE TRANSVERSAL QUE ACTUALMENTE DISPONE;ME PARECE EXCELENTE QUE TOMEN EN CUENTA EL ÁMBITO DE LA ÉTICA EN UNA CARRERA TAN PROPENSA A ESTAS SITUACIONES Y ADIVERSOS CUESTIONAMIENTOS, HABLA MUY BIEN DE LA EDUCACIÓN QUE EN LA EAN SE DA
